link,name,desc,header_image,genre,developer,release_date,reviews,current_players,peak_today,anti_cheat,metacritic,drm_notes,type_game,notes,safe,status,last_updated,added_at
https://store.steampowered.com/app/2661160/,Goober Dash,"Goober Dash: A 2D platformer battle royale where Goobers Run, Jump &amp; Dash to victory! Customize your Goober, dash to outmaneuver opponents, create your own levels, and compete in global time trials. Unlock exclusive skins and celebrate your wins in this action-packed multiplayer Race Royale!",https://shared.akamai.steamstatic.com/store_item_assets/steam/apps/2661160/header.jpg?t=1764259029,Battle Royale,Winterpixel Games Inc.,"Nov 27, 2025",90% (Very Positive),5,5,-,N/A,None detected,online,Not reviewed yet,?,active,2026-03-17T06:32:25Z,2026-03-12 08:16:55+00:00
https://store.steampowered.com/app/3608300/,Jackpot.de,Play our prize-winning slots in the best free2play funtime casino out there. The Las Vegas experience of a lifetime awaits you! We've got more than 200 of the best slots and jackpots you can find. You simply won't be able to resist! Our jackpot game offers you fun without end!,https://shared.akamai.steamstatic.com/store_item_assets/steam/apps/3608300/2dfa11d296ec5cd1c59edfa21393927fbcd50502/header.jpg?t=1764250323,Gambling,Whow Games GmbH,"Nov 27, 2025",62% (8 user reviews),2,3,-,N/A,None detected,online,Not reviewed yet,?,active,2026-03-17T06:32:27Z,2026-03-12 08:16:57+00:00
https://store.steampowered.com/app/3555430/,Money Simulator: Brokeville,"Welcome to the Brokeville! Grind your way to the top through jobs, deliveries, bicycle races, and risky crypto trades. Buy, customize, and sell cars &amp; motorcycles for profit. Build your own businesses, manage them, and hire staff to grow your empire.",https://shared.akamai.steamstatic.com/store_item_assets/steam/apps/3555430/38cd521a766d1e511ebcaebca221b443ab2a76fa/header.jpg?t=1771934988,Simulation,Organica,"Nov 27, 2025",87% (Very Positive),90,90,-,N/A,None detected,offline,Not reviewed yet,?,active,2026-03-17T06:32:29Z,2026-03-12 08:17:00+00:00
https://store.steampowered.com/app/716350/,Reign of Guilds,"Reign of Guilds — the spiritual successor to the old-school fantasy where steel, magic, and skill decide your fate. Inspired by the legacy of Ultima Online and EverQuest.",https://shared.akamai.steamstatic.com/store_item_assets/steam/apps/716350/63aff795fb370bfc05b15af238b5ceaab51ced5a/header.jpg?t=1764588000,MMORPG,Atlant Games ltd,"Nov 26, 2025",62% (Mixed),9,27,-,N/A,None detected,online,Not reviewed yet,?,active,2026-03-17T06:32:31Z,2026-03-12 08:17:03+00:00
https://store.steampowered.com/app/4062110/,Dilemma Dungeon,"A co-op roguelike dungeon exploration game. As you progress with your teammates, you will face dilemma choices where growing stronger yourself means someone else becomes weaker. Each run, you must create builds by combining different maps, classes, skills, and items, and overcome the cursed dungeon.",https://shared.akamai.steamstatic.com/store_item_assets/steam/apps/4062110/5ac94fbe708e51531fff6433c3d5a649a3b69e57/header.jpg?t=1770973705,Top-down Shooter,Potanity,"Nov 24, 2025",38% (Mostly Negative),0,0,-,N/A,None detected,online,Not reviewed yet,?,active,2026-03-17T06:32:33Z,2026-03-12 08:17:06+00:00
https://store.steampowered.com/app/4082300/,Million Card Game,Compete with 1-5 players in this interactive cozy indie card game! Strategize table layouts and hand placement in order to be the first top win!,https://shared.akamai.steamstatic.com/store_item_assets/steam/apps/4082300/5749654d8056bef50d2857f9ef008e89762bffb1/header.jpg?t=1764022861,Card Game,Mako,"Nov 24, 2025",75% (4 user reviews),0,0,-,N/A,None detected,online,Not reviewed yet,?,active,2026-03-17T06:32:34Z,2026-03-12 08:17:09+00:00
https://store.steampowered.com/app/4153560/,The Shadow of Shadows,Lilith is a young Shadow that wants to be a Light. She embarks on a journey to learn how Light is made but is about to find out a horrible secret. Will you help her turn the tides?,https://shared.akamai.steamstatic.com/store_item_assets/steam/apps/4153560/32b46db19e78a907f42e4a6e647aea8c77628e74/header.jpg?t=1764021695,Puzzle,Stavros Aeneas Kokkineas,"Nov 24, 2025",100% (3 user reviews),0,0,-,N/A,None detected,offline,Not reviewed yet,?,active,2026-03-17T06:32:36Z,2026-03-12 08:17:12+00:00
https://store.steampowered.com/app/4007740/,Top Heroes,"◆ Embark on an Adventure Explore unknown lands, unlock ancient ruins, and brave dangerous dungeons! ◆ Build Your Kingdom Create a thriving realm from scratch and turn your dream city into reality! ◆ Achieve Glory with Your Guild Form powerful alliances with players worldwide, and conquer the world!",https://shared.akamai.steamstatic.com/store_item_assets/steam/apps/4007740/8ad1a49a5760b3472920a1dad84b8c8f5bee4ccb/header.jpg?t=1773234481,MMORPG,Rivergame HK Limited,"Nov 24, 2025",52% (Mixed),218,223,-,N/A,None detected,online,Not reviewed yet,?,active,2026-03-17T06:32:38Z,2026-03-12 08:17:15+00:00
https://store.steampowered.com/app/2987080/,Battle of Goldfish Scooping,"&quot;Battle of Goldfish Scooping&quot; is an asymmetrical multiplayer action game. Players take on the roles of scoops and goldfish to aim for high scores. Based on your previous play results, you can acquire skills and enhance parameters to aim for even higher scores!",https://shared.akamai.steamstatic.com/store_item_assets/steam/apps/2987080/78d25813f2b7a5133d89455a4462aee23d5017b5/header.jpg?t=1764253349,Action RPG,CreCre,"Nov 23, 2025",76% (Mostly Positive),0,1,-,N/A,None detected,online,Not reviewed yet,?,active,2026-03-17T06:32:39Z,2026-03-12 08:17:18+00:00
https://store.steampowered.com/app/1413250/,Republic of Jungle,"Gather your friends (5 to 10 players) and play as advisors to President Puma. His re-election depends on your loyalty. In a social deduction party game, Leakers try to sneak into missions to leak Puma's secrets- Loyalists try to suss them out. Read the room and bluff your way to a political victory.",https://shared.akamai.steamstatic.com/store_item_assets/steam/apps/1413250/header.jpg?t=1763931450,Party Game,Gerdoo Games,"Nov 23, 2025",76% (Mostly Positive),2,2,-,N/A,None detected,online,Not reviewed yet,?,active,2026-03-17T06:32:41Z,2026-03-12 08:17:22+00:00
https://store.steampowered.com/app/3806060/,Stress Relief,"Stress Relief is an idler game, which comes with a reliable companion, the Slime! Are you bored? Are you stressed because of work? Come and destroy your desktop with the tools included! Play, earn Pixel Points and get drops every 25 minutes!",https://shared.akamai.steamstatic.com/store_item_assets/steam/apps/3806060/9593028a7c60e51ff3a5de007bc98c55e5259496/header.jpg?t=1766478710,Clicker,Shitshow Interactive,"Nov 23, 2025",88% (Positive),6,6,-,N/A,None detected,offline,Not reviewed yet,?,active,2026-03-17T06:32:42Z,2026-03-12 08:17:25+00:00
https://store.steampowered.com/app/3733440/,Tiny Crate,Tiny Crate is a Crate Chucking Action Puzzle Game ! Leap over spikes and stack up crates to reach the portal in each puzzle. Collect hidden musical notes (-:,https://shared.akamai.steamstatic.com/store_item_assets/steam/apps/3733440/cab5d935a873bfbcf5a5b3ef8fa48b35831628f5/header.jpg?t=1770270746,Puzzle,Harmony Monroe,"Nov 23, 2025",89% (Very Positive),1,1,-,N/A,None detected,offline,Not reviewed yet,?,active,2026-03-17T06:32:43Z,2026-03-12 08:17:27+00:00
https://store.steampowered.com/app/3951230/,Myrkwood: Offshoot,Myrkwood: Offshoot is a top-down survival defense game that you can play with friends! Defend the Gem as you fight through waves of enemies!,https://shared.akamai.steamstatic.com/store_item_assets/steam/apps/3951230/ad746a8e2eaeac81440d7bfe011d5ac879fa141e/header.jpg?t=1763762877,Top-down Survival,minota,"Nov 21, 2025",100% (6 user reviews),0,0,-,N/A,None detected,offline,Not reviewed yet,?,active,2026-03-17T06:32:45Z,2026-03-12 08:17:31+00:00
https://store.steampowered.com/app/4032230/,Slime Saga,"Train slimes, make friends, and get set for adventure! It's time to pick up your slime catcher and become the latest and greatest tamer!",https://shared.akamai.steamstatic.com/store_item_assets/steam/apps/4032230/554dfe3f89fd522c8bdb766cee62ef3e0cbd43ec/header.jpg?t=1763762364,MMORPG,Octogames LLC,"Nov 21, 2025",58% (Mixed),1,1,-,N/A,None detected,online,Not reviewed yet,?,active,2026-03-17T06:32:46Z,2026-03-12 08:17:34+00:00
https://store.steampowered.com/app/4144120/,Rink Rascals,"Dash, steal, and score with up to 6 players on an outdoor hockey rink. Choose your class, customize your gear, battle for the puck, and score epic goals in this fast-paced cartoon-style hockey game full of action.",https://shared.akamai.steamstatic.com/store_item_assets/steam/apps/4144120/1470f23806108a0c71a0dc73986c3994fbcb4208/header.jpg?t=1763757022,Sports,Cardinal Creek Studio,"Nov 21, 2025",67% (Mixed),0,0,-,N/A,None detected,online,Not reviewed yet,?,active,2026-03-17T06:32:48Z,2026-03-12 08:17:37+00:00
https://store.steampowered.com/app/3632680/,HeXpunk,"HexPunk is a co-op, third-person shooter with an emphasis on stylish and fast-paced combat.",https://shared.akamai.steamstatic.com/store_item_assets/steam/apps/3632680/2a85379bb2b00ea9893b3997fe7f284969541cd2/header.jpg?t=1750218273,Arcade,DigitalWizardsGames,"May 9, 2025",68% (Mixed),0,0,-,N/A,None detected,online,Not reviewed yet,?,active,2026-03-17T06:32:50Z,2026-03-12 08:17:40+00:00
https://store.steampowered.com/app/4183380/,Fall Asleep,"Fall Asleep is a tense first-person climbing game where you’re trapped in a nightmare and the only way out is up. See only the platforms in front of you, make every jump count, and try to escape before the dream swallows you whole.",https://shared.akamai.steamstatic.com/store_item_assets/steam/apps/4183380/e8471fa2c6a0af64ed3f85aae6065d670b550e2f/header.jpg?t=1767228374,Horror,Overthrown Interactive,"Dec 31, 2025",53% (Mixed),0,0,-,N/A,None detected,offline,Not reviewed yet,?,active,2026-03-17T06:32:51Z,2026-03-12 08:17:43+00:00
https://store.steampowered.com/app/3853020/,Sunflower Stronghold,"Grow Crops, Process Resources and Construct Towers and Defend!",https://shared.akamai.steamstatic.com/store_item_assets/steam/apps/3853020/3d1cbfae311e78a0f24dab0f3ea3f2e4403a00c8/header.jpg?t=1768018143,Real-Time Strategy,Phone UnBusters,"Dec 29, 2025",100% (7 user reviews),0,0,-,N/A,None detected,offline,Not reviewed yet,?,active,2026-03-17T06:32:53Z,2026-03-12 08:17:47+00:00
https://store.steampowered.com/app/4220180/,Little Smiles Daycare,"A short psychological horror experience set inside an abandoned daycare. Explore, uncover hidden notes, solve eerie mysteries, and discover what happened to Little Smiles Daycare, before something finds you first.",https://shared.akamai.steamstatic.com/store_item_assets/steam/apps/4220180/22a314d0e932e6e600707bfed0da776b2a8f6494/header.jpg?t=1767252487,Horror,Sergio W.,"Dec 31, 2025",67% (6 user reviews),0,0,-,N/A,None detected,offline,Not reviewed yet,?,active,2026-03-17T06:32:55Z,2026-03-12 08:17:49+00:00
https://store.steampowered.com/app/4223440/,Ktrl Smash,"Ktrl Smash is a fast-paced multiplayer arena game where anything can become a weapon. Pick your fighter, grab bats, baseballs, or even chairs, collect stat boosts, and fight to get the most kills before time runs out. Stay alert, keep moving, and defeat as many players as you can.",https://shared.akamai.steamstatic.com/store_item_assets/steam/apps/4223440/7216efd379c835a6bde34ad754f5ab9d73e12992/header.jpg?t=1773290425,Fighting,FIFTYFIVE GAMING STUDIO PRIVATE LIMITED,"Dec 31, 2025",71% (Mostly Positive),0,0,-,N/A,None detected,online,Not reviewed yet,?,active,2026-03-17T06:32:56Z,2026-03-12 08:17:53+00:00
https://store.steampowered.com/app/3767360/,今夜无人入眠 No One Sleep Tonight,"No One Sleep Tonight is a game that focuses on the feeling of Night. You will go through multiple midnight scenes and experience different environments and gameplay, explore this world created by street lamp, moonlight, and wind.",https://shared.akamai.steamstatic.com/store_item_assets/steam/apps/3767360/fe134f1e030bfe9510e501036d36b87dfc62e6f3/header.jpg?t=1767186617,Strategy,落夜,"Dec 31, 2025",89% (9 user reviews),0,0,-,N/A,None detected,offline,Not reviewed yet,?,active,2026-03-17T06:32:58Z,2026-03-12 08:17:56+00:00
https://store.steampowered.com/app/1645050/,SurLeFil,"On the Wire is an educational game mixing science, history and humor. Follow ProfFil’s lessons, help Kelhann complete his missions, and discover the wonders of electricity, mechanics, and more.",https://shared.akamai.steamstatic.com/store_item_assets/steam/apps/1645050/header.jpg?t=1767940374,Education,Angelo'Studio,"Dec 31, 2025",100% (4 user reviews),0,0,-,N/A,None detected,offline,Not reviewed yet,?,active,2026-03-17T06:33:18Z,2026-03-12 08:18:00+00:00
https://store.steampowered.com/app/4256310/,S.P.E.C.T.O.R 01,S.P.E.C.T.O.R 01 is a Third-Person SCI-FI action shooter. You are a soldier in the distant future on a solo rescue mission codenamed S.P.E.C.T.O.R 01. Aliens have taken over certain areas around earth and have taken one of your fellow soldiers hostage. Your task is to bring them to safety.,https://shared.akamai.steamstatic.com/store_item_assets/steam/apps/4256310/51e26e13a61bf299fd2564e49c1e6a3971037cc2/header.jpg?t=1767164124,Third-Person Shooter,NAKGAMES,"Dec 30, 2025",75% (Mostly Positive),0,0,-,N/A,None detected,offline,Not reviewed yet,?,active,2026-03-17T06:33:20Z,2026-03-12 08:18:03+00:00
https://store.steampowered.com/app/4219340/,Fruit Fusion!,"Help Aira, Rinka and Yuri merge fruit and unlock new cards in this sweet and charming Suika x Deckbuilder!",https://shared.akamai.steamstatic.com/store_item_assets/steam/apps/4219340/c2e6e6449895f883afa648110d52c0f640d88f32/header.jpg?t=1767109861,Card Game,Mangobits Studios,"Dec 30, 2025",100% (Positive),0,0,-,N/A,None detected,offline,Not reviewed yet,?,active,2026-03-17T06:33:22Z,2026-03-12 08:18:06+00:00
https://store.steampowered.com/app/4178290/,Hivefront TD,"Collect your insect army and defend the hive as either Ants or Bees in this awesome tower defense adventure, brought to life with a hand-drawn art style!",https://shared.akamai.steamstatic.com/store_item_assets/steam/apps/4178290/7eeda62929faf0a1902dfa6f57d2ead9ad7243e3/header.jpg?t=1767031303,Tower Defense,SUPER ANT STUDIO,"Dec 29, 2025",100% (Positive),0,0,-,N/A,None detected,offline,Not reviewed yet,?,active,2026-03-17T06:33:24Z,2026-03-12 08:18:09+00:00
https://store.steampowered.com/app/3273680/,Supercar Evolution 2025,The first-ever true MMO supercar racing game is here! Play with up to 39 friends!,https://shared.akamai.steamstatic.com/store_item_assets/steam/apps/3273680/header.jpg?t=1767022451,Racing,Petr Šimůnek,"Dec 29, 2025",60% (Mixed),2,2,-,N/A,None detected,online,Not reviewed yet,?,active,2026-03-17T06:33:26Z,2026-03-12 08:18:13+00:00
https://store.steampowered.com/app/4231540/,SportsBlitz,"SportsBlitz, a retro themed micro game collection of sports games.",https://shared.akamai.steamstatic.com/store_item_assets/steam/apps/4231540/4e14def8341ee86d958cf35a899d2a28aa7587e9/header.jpg?t=1766997364,Sports,"Hayden Longfield, Thomas Drage, Blake Cardilini, Jeremiah Franklin, AJ Weston, Luke Woodman","Dec 29, 2025",80% (5 user reviews),0,0,-,N/A,None detected,offline,Not reviewed yet,?,active,2026-03-17T06:33:27Z,2026-03-12 08:18:16+00:00
https://store.steampowered.com/app/4236560/,Action PUZZLE,"Clear as many lines as possible to earn a high score. Blocks will fall in response to your character's movements, so avoid them skillfully.",https://shared.akamai.steamstatic.com/store_item_assets/steam/apps/4236560/fb07be67c00e25c1e6646372fb98fb041be6e85d/header.jpg?t=1766861257,Puzzle,TOANYAKO,"Dec 27, 2025",71% (7 user reviews),0,0,-,N/A,None detected,offline,Not reviewed yet,?,active,2026-03-17T06:33:28Z,2026-03-12 08:18:19+00:00
https://store.steampowered.com/app/4205780/,Skybound,"Skybound is a 3D exploration platformer focused on fun, fluid movement mechanics, parkour and environmental puzzle solving.",https://shared.akamai.steamstatic.com/store_item_assets/steam/apps/4205780/12586037a26ed2202c1373e6be988a710a8f0f2e/header.jpg?t=1770814578,Platformer,Half Home Games,"Dec 26, 2025",93% (Very Positive),0,0,-,N/A,None detected,offline,Not reviewed yet,?,active,2026-03-17T06:33:30Z,2026-03-12 08:18:22+00:00
https://store.steampowered.com/app/4237360/,SlimyLeap,SlimyLeap is a fast-paced pixel-art infinite runner where you play as a brave little slime trying to go as far as possible without dying.,https://shared.akamai.steamstatic.com/store_item_assets/steam/apps/4237360/0af5492ae30f027a195ccc83b7b17c7108f0f256/header.jpg?t=1771269408,Platformer,Blazej Cholinski,"Dec 26, 2025",93% (Positive),0,0,-,N/A,None detected,offline,Not reviewed yet,?,active,2026-03-17T06:33:32Z,2026-03-12 08:18:26+00:00
https://store.steampowered.com/app/2969590/,Monstro Maestro,"Play as a conductor trapped in a haunted and crazy mansion! As a concert begins, a jealous ghost appears and takes possession of your orchestra. To free them, you must explore every corner of the mansion, complete musical challenges, and rebuild your troupe.",https://shared.akamai.steamstatic.com/store_item_assets/steam/apps/2969590/757826b2952820b35d2eea1614ad011085ee2f9b/header.jpg?t=1770017759,Platformer,Game Academy,"Jan 1, 2026",94% (Very Positive),0,0,-,N/A,None detected,offline,Not reviewed yet,?,active,2026-03-17T06:33:34Z,2026-03-12 08:18:29+00:00
https://store.steampowered.com/app/4123780/,The wild darkness,"Explore a survival-roguelike RPG set in an unknown and bizarre world. To withstand its many dangers, you'll need to gain new knowledge, scavenge for food, and acquire useful items. Craft, build, and learn your way through a crucial adventure to uncover the world's secrets.",https://shared.akamai.steamstatic.com/store_item_assets/steam/apps/4123780/171d09d8f61e285c636ae10c5dde84f59205659a/header.jpg?t=1767162779,Roguelike,popeyed inc,"Dec 30, 2025",81% (Very Positive),31,31,-,N/A,None detected,offline,Not reviewed yet,?,active,2026-03-17T06:33:36Z,2026-03-12 08:18:32+00:00
https://store.steampowered.com/app/4241560/,Oh Balls Merge,"Drop, merge, and score! Immerse yourself in the addictive ball-merging mania of Oh Balls and see how high you can go.",https://shared.akamai.steamstatic.com/store_item_assets/steam/apps/4241560/3e0cb55934e8172ed1edf2d901d0d84db02bd4e8/header.jpg?t=1767548329,Puzzle,Harrison Digital,"Dec 31, 2025",100% (9 user reviews),1,1,-,N/A,None detected,offline,Not reviewed yet,?,active,2026-03-17T06:33:38Z,2026-03-12 08:18:34+00:00
https://store.steampowered.com/app/3486280/,Long Knives,An oriental narrative mystery. The story branches upon your choices. The dice lies.,https://shared.akamai.steamstatic.com/store_item_assets/steam/apps/3486280/header.jpg?t=1770706088,Visual Novel,Jade Hex,"Dec 31, 2025",100% (Very Positive),11,11,-,N/A,None detected,offline,Not support English language. (Only Chinese),?,active,2026-03-17T06:33:40Z,2026-03-12 08:18:38+00:00
https://store.steampowered.com/app/4169600/,勇者之灾 Calamity from the Yongzhe,"This is an experimental RPG game. The work tells an adventure story set in a fictional world, revolving around the conflict and journey between the King who unified the world and a brave team of Yongzhe(Hero) on a quest to overthrow him. It's a grand adventure filled with both laughter and tears.",https://shared.akamai.steamstatic.com/store_item_assets/steam/apps/4169600/54a9f24c8a46dac37104e339451436f43303d8af/header.jpg?t=1767156640,Turn-based RPG,wmv41 studio,"Dec 30, 2025",100% (4 user reviews),0,0,-,N/A,None detected,offline,Not support English language. (Only Chinese),?,active,2026-03-17T06:33:41Z,2026-03-12 08:18:41+00:00
https://store.steampowered.com/app/4235540/,宝姉妹 | スクラッチシミュレーター,「宝姉妹 | スクラッチシミュレーター」は、ヤングガンガンで連載中のハートフルマネーコメディ漫画『宝姉妹』のキャラクターたちと一緒に、スクラッチくじ気分を味わえるシミュレーションゲームです。スクラッチを削って当たりマスをチェック。 タテ・ヨコ・ナナメのいずれか一列に同じ絵柄が3個並ぶと当たり！そろった絵柄に応じて当選金が受け取れます。 1等100万円当選を目指していっぱい削ろう！ ※本作はゲーム内のみで完結するスクラッチ風シミュレーションです。 現実のお金の売買・賭け行為・実在のくじとは一切関係ありません。 ゲーム内で当選しても、現金や実物の賞品がもらえることはありません。,https://shared.akamai.steamstatic.com/store_item_assets/steam/apps/4235540/64c6ce4bfb8983ecce06af4ae2a95010590e2b0a/header.jpg?t=1766612357,Party Game,"久川はる, 園児ニア","Dec 24, 2025",92% (Positive),0,0,-,N/A,None detected,offline,Not support English language. (Only Japanese),?,active,2026-03-17T06:33:43Z,2026-03-12 08:18:50+00:00
https://store.steampowered.com/app/4184690/,Herofrenia Infinite Hyperdeath,"Herofrenia Infinite Hyperdeath é um jogo top down shooter do universo do RPG multimidia Herofrenia! Conte com um arsenal variado de armas para compor seu arsenal em um estilo de jogo frenético com movimentação veloz, dash e mortes frequentes! Quanto mais sangue as coisas ficam mais lentas ao redor",https://shared.akamai.steamstatic.com/store_item_assets/steam/apps/4184690/77641eb68d15fe27a8a1ab4503e0c97578b61f38/header.jpg?t=1766542621,Beat 'em up,Herofrenia Inc,"Dec 23, 2025",100% (1 user reviews),0,0,-,N/A,None detected,offline,Not support English language. (Only Portuguese - Brazil),?,active,2026-03-17T06:33:44Z,2026-03-12 08:18:53+00:00
https://store.steampowered.com/app/4207860/,エレベーション,百貨店巡回ホラーアドベンチャー。かつて奇妙な使用方法で流行した鎮静剤「エレベーション」、上昇を続けるエレベーター、留まる時間。夜間警備員の青年二名が、上階を目指しつつ巡回し、各フロアで異常事態の真相を探る。,https://shared.akamai.steamstatic.com/store_item_assets/steam/apps/4207860/b44b5d5ff50b64616e9312bf400db12c0ddf8a80/header.jpg?t=1766822989,Horror,電話倉庫,"Dec 22, 2025",100% (Positive),0,0,-,N/A,None detected,offline,Not support English language. (Only Japanese),?,active,2026-03-17T06:33:46Z,2026-03-12 08:18:56+00:00
https://store.steampowered.com/app/4081810/,토끼의 거짓말,"Bunny's Lie is a real-time card game based on a moon rabbit in a Korean myth. Your luck doesn't matter in this match. You can win even if you don't have a good hand, if you just have wits and bluffing. Enjoy a fierce battle under the moonlight, with the cute bunnies. (ENG ver will be updated later.)",https://shared.akamai.steamstatic.com/store_item_assets/steam/apps/4081810/0fcc2c6f83b1275b776ae96c764cab5f5d6380da/header.jpg?t=1768633017,Card Game,CIEN (씨엔) - Chung-Ang University IT Entertainment Club,"Dec 22, 2025",90% (Positive),0,0,-,N/A,None detected,online,Not support English language. (Only Korean),?,active,2026-03-17T06:33:47Z,2026-03-12 08:18:59+00:00
https://store.steampowered.com/app/3540640/,浮空秘境,《浮空秘境》是一款经典日式RPG像素风休闲放置游戏。传说中光之女神缔造了神圣的埃蒙大陆，然而这里的魔法文明正悄然被恶念侵蚀，蛰伏千年的魔王即将复苏。纷乱的时空下，一个光怪陆离的梦开启了你尘封的记忆，你开始回想起遥远时光里的一切：在那片被战火倾轧的千疮百孔的大陆上，一直有一个坚毅背影引领人们走向光明，而那个背影就是身为执行者的“你”！ 记忆复苏意味着封印的松动，浮空大陆的沉浮命运再次交到了你的手中。面对即将来临的风雨，身处风暴中心的你将做出怎样的抉择……,https://shared.akamai.steamstatic.com/store_item_assets/steam/apps/3540640/17d22247a5904057473f8f24a17234abfbd34667/header.jpg?t=1766391086,MMORPG,厦门魔兔网络科技有限公司,"Dec 22, 2025",33% (3 user reviews),1,1,-,N/A,None detected,online,Not support English language. (Only Chinese),?,active,2026-03-17T06:33:48Z,2026-03-12 08:19:03+00:00
https://store.steampowered.com/app/4218460/,BND-Legenden: Operation Blackbox,"BND Legends: Operation Blackbox is a tactical stealth adventure where you guide agent AJ through a fortified tech compound, infiltrate enemy systems, steal critical data, and complete clever minigames with support from your elite BND team.",https://shared.akamai.steamstatic.com/store_item_assets/steam/apps/4218460/90305ea94c0c4cfa7092bb758e68bf9122e5c4df/header.jpg?t=1766483469,Stealth,"Umami Creative GmbH, Bundesnachrichtendienst (BND)","Dec 22, 2025",88% (Positive),0,0,-,N/A,None detected,offline,Not support English language. (Only German),?,active,2026-03-17T06:33:50Z,2026-03-12 08:19:06+00:00
https://store.steampowered.com/app/2753740/,TOREROWA,Explore dungeons in your spare time! Roguelike dungeon RPG with a party of up to 3 players to challenge dungeons!,https://shared.akamai.steamstatic.com/store_item_assets/steam/apps/2753740/a0d499459156ac34bce35147622ea46052f5fbc0/header.jpg?t=1766371850,Roguelike,"Asobimo, Inc.","Dec 21, 2025",40% (Mixed),1,3,-,N/A,None detected,online,Not reviewed yet,?,active,2026-03-17T06:33:52Z,2026-03-12 08:19:13+00:00
