link,name,desc,header_image,genre,developer,release_date,reviews,current_players,peak_today,anti_cheat,metacritic,drm_notes,type_game,notes,safe,status,last_updated,added_at
https://store.steampowered.com/app/4212340/,100 Radioactive Cats,🐾 Join the cutest adventure in themed locations full of cats! 😻 Explore the charming hand-drawn artwork of special places and try to find 100 adorable cats hidden throughout the game. 🐈🕵️‍♂️ Can you find them all? 🕵️‍♂️🐈,https://shared.akamai.steamstatic.com/store_item_assets/steam/apps/4212340/1d6a82c6cce8d37e53b2f9e4fb384fa28c042093/header.jpg?t=1765900760,Hidden Object,"100 Cozy Games, Cats","Dec 14, 2025",86% (Very Positive),0,0,-,N/A,None detected,offline,Not reviewed yet,?,active,2026-03-17T06:36:56Z,2026-03-12 08:24:15+00:00
https://store.steampowered.com/app/2827560/,100 Romantic Cats,🐾 Join the cutest adventure in themed locations full of cats! 😻 Explore the charming hand-drawn artwork of special places and try to find 100 adorable cats hidden throughout the game. 🐈🕵️‍♂️ Can you find them all? 🕵️‍♂️🐈,https://shared.akamai.steamstatic.com/store_item_assets/steam/apps/2827560/header.jpg?t=1744908032,Hidden Object,"100 Cozy Games, Cats","Feb 13, 2025",95% (Overwhelmingly Positive),3,3,-,N/A,None detected,offline,Not reviewed yet,?,active,2026-03-17T06:36:57Z,2026-03-12 08:24:17+00:00
https://store.steampowered.com/app/2854290/,100 Space Cats,👨‍🚀🌌Join the cutest space adventure with Cats in Space! 🪐🚀 Explore charming hand-drawn space locations and adorable cosmo-cats on a quest to find 100 hidden kitties. 🕵️‍♂️❌ Can you find them all? 🕵️‍♂️🐈✅,https://shared.akamai.steamstatic.com/store_item_assets/steam/apps/2854290/header.jpg?t=1744908093,Hidden Object,"100 Cozy Games, Cats","Jun 16, 2024",70% (Mixed),0,0,-,N/A,None detected,offline,Not reviewed yet,?,active,2026-03-17T06:36:59Z,2026-03-12 08:24:21+00:00
https://store.steampowered.com/app/3037060/,100 Waiting Cats,⏳🐾 Join the cutest adventure in the funny waiting situations full of cats! Explore the charming hand-drawn artworks of While Waiting themed locations as you embark on a quest to find 100 adorable cats hidden throughout the game.🕑🐈 🕵️‍♂️ Can you find them all? 🕵️‍♂️🐈✅,https://shared.akamai.steamstatic.com/store_item_assets/steam/apps/3037060/header.jpg?t=1744908130,Hidden Object,"100 Cozy Games, Cats","Oct 6, 2024",96% (Overwhelmingly Positive),0,0,-,N/A,None detected,offline,Not reviewed yet,?,active,2026-03-17T06:37:00Z,2026-03-12 08:24:24+00:00
https://store.steampowered.com/app/2345380/,100% Challenge,"Action arcade! CAPTURE enemies of your color and AVOID the rest to become the best in the world! Fast, addictive and 100% challenging!",https://shared.akamai.steamstatic.com/store_item_assets/steam/apps/2345380/header.jpg?t=1718622819,Bullet Hell,findemor,"Apr 24, 2023",92% (Very Positive),0,0,-,N/A,None detected,offline,Not reviewed yet,?,active,2026-03-17T06:37:02Z,2026-03-12 08:24:27+00:00
https://store.steampowered.com/app/2842420/,1000 Cuts: Jomaku,"A challenging 2D action platformer with brutal one-hit-kill combat, consequential choices, and a lore-rich story set in the dark fantasy world of Kurogawa, Japan. Inspired by Sekiro and Blasphemous, Jomaku is a free preview of One-Thousand Cuts, &quot;raising the curtain&quot; for the full game coming soon!",https://shared.akamai.steamstatic.com/store_item_assets/steam/apps/2842420/header.jpg?t=1755702423,Souls-like,Banjo Toad Studio,"Mar 8, 2024",86% (Very Positive),0,0,-,N/A,None detected,offline,Not reviewed yet,?,active,2026-03-17T06:37:03Z,2026-03-12 08:24:30+00:00
https://store.steampowered.com/app/1157020/,1001 Hugs,"Kid friendly action game - to bring Christmas presents to Santa. For a low poly 3D shooter it has a unique gameplay. You have to hug key elves and deal with mischief ones to pass through levels. 1001 Hugs has a new game story, more levels, achievements, leaderboard, and character customization.",https://shared.akamai.steamstatic.com/store_item_assets/steam/apps/1157020/header.jpg?t=1668081633,Strategy,Aigul Aubanova,"Sep 26, 2019",76% (Mostly Positive),0,0,-,N/A,None detected,offline,Not reviewed yet,?,active,2026-03-17T06:37:05Z,2026-03-12 08:24:34+00:00
https://store.steampowered.com/app/3140910/,100th Bug Brigade,"100th Bug Brigade is an accessible, story-rich, tactical, team-based roleplaying game featuring very cute bugs in a very uncute time.",https://shared.akamai.steamstatic.com/store_item_assets/steam/apps/3140910/644f25d812f9dff5284dc4e5e2ef17ac261445b6/header.jpg?t=1744397970,Turn-based Tactics,"Aidan Andreasen, Alex Rovner, Ellen Brannon, Monica Santiago, Patrick Galang, Peter Ampudia, Sam Meyer, Varick Santana","Apr 11, 2025",75% (Mostly Positive),0,0,-,N/A,None detected,offline,Not reviewed yet,?,active,2026-03-17T06:37:06Z,2026-03-12 08:24:37+00:00
https://store.steampowered.com/app/2598690/,10:16,"To get to heaven, you must climb the Nine Circles of Hell. But you might never make it to the depths.",https://shared.akamai.steamstatic.com/store_item_assets/steam/apps/2598690/header.jpg?t=1767934121,Visual Novel,Catsket,"Oct 16, 2023",88% (Very Positive),0,0,-,N/A,None detected,offline,Not reviewed yet,?,active,2026-03-17T06:37:07Z,2026-03-12 08:24:40+00:00
https://store.steampowered.com/app/1973530/,Limbus Company,"As the Executive Manager of Limbus Company, lead your group of twelve Sinners, venture into the buried facilities of Lobotomy Corporation, and lay claim on the Golden Boughs.",https://shared.akamai.steamstatic.com/store_item_assets/steam/apps/1973530/header.jpg?t=1772199208,Turn-based Tactics,ProjectMoon,"Feb 26, 2023",88% (Very Positive),"54,104","73,859",-,N/A,None detected,online,Not reviewed yet,?,active,2026-03-17T06:37:09Z,2026-03-12 08:24:44+00:00
https://store.steampowered.com/app/359550/,Tom Clancy's Rainbow Six Siege,"Rainbow Six® Siege is the reference in tactical team shooters, where elite strategy and execution triumph. Enjoy free access to Quick Match, Unranked, and Dual Front game modes with a selection of operators.",https://shared.akamai.steamstatic.com/store_item_assets/steam/apps/359550/d4166355943c784e77048bd3434ecb03497cbc16/header_alt_assets_18.jpg?t=1772669144,FPS,Ubisoft Montreal,"Dec 1, 2015",83% (Very Positive),"104,098","104,098",-,N/A,None detected,online,Not reviewed yet,?,active,2026-03-17T06:37:11Z,2026-03-12 08:24:48+00:00
https://store.steampowered.com/app/1222670/,The Sims™ 4,Play with life and discover the possibilities. Unleash your imagination and create a world of Sims that’s wholly unique. Explore and customize every detail from Sims to homes–and much more.,https://shared.akamai.steamstatic.com/store_item_assets/steam/apps/1222670/header.jpg?t=1773072790,Life Sim,Maxis,"Jun 18, 2020",87% (Very Positive),"27,371","27,371",-,N/A,EA online activation and EA app software installation and background use required.,online,Not reviewed yet,?,active,2026-03-17T06:37:12Z,2026-03-12 08:24:51+00:00
https://store.steampowered.com/app/1085660/,Destiny 2,"Destiny 2 is an action MMO with a single evolving world that you and your friends can join anytime, anywhere, absolutely free.",https://shared.akamai.steamstatic.com/store_item_assets/steam/apps/1085660/header.jpg?t=1765904462,Looter Shooter,Bungie,"Oct 1, 2019",77% (Mostly Positive),"8,525","8,525",-,83,None detected,online,Not reviewed yet,?,active,2026-03-17T06:37:14Z,2026-03-12 08:24:54+00:00
https://store.steampowered.com/app/2357570/,Overwatch®,"Overwatch®, A FUTURE WORTH FIGHTING FOR! Overwatch® is an always-on and ever-evolving free-to-play, team-based action game set in an optimistic future, where every match is the ultimate 5v5 or 6v6 battlefield brawl.",https://shared.akamai.steamstatic.com/store_item_assets/steam/apps/2357570/2044d29c64bf646c162052110e66c922fef47e7a/header_alt_assets_19.jpg?t=1771358111,Hero Shooter,"Blizzard Entertainment, Inc.","Aug 10, 2023",29% (Mostly Negative),"93,063","93,063",-,N/A,None detected,online,Not reviewed yet,?,active,2026-03-17T06:37:16Z,2026-03-12 08:24:58+00:00
https://store.steampowered.com/app/2073850/,THE FINALS,"THE FINALS is the world’s first Dynamism Shooter, a free-to-play, fast-paced, physics-driven, first-person shooter set on the stage of the biggest Gameshow of the future! Fight for Fans and fortune in fully-destructible, virtual Arenas that guarantee no two rounds will ever play the same!",https://shared.akamai.steamstatic.com/store_item_assets/steam/apps/2073850/7cb28d822b86affe0f10eef8fe62caa7d5edd178/header.jpg?t=1772116732,FPS,Embark Studios,"Dec 7, 2023",78% (Mostly Positive),"11,891","11,891",-,N/A,None detected,online,Not reviewed yet,?,active,2026-03-17T06:37:18Z,2026-03-12 08:25:02+00:00
https://store.steampowered.com/app/3224770/,Umamusume: Pretty Derby,"Umamusume: Pretty Derby, winner of Best Mobile Game at The Game Awards 2025, is ready to race! Scout featured trainees and supporters as you navigate the immersive sports life simulation through the game's in-depth training system and top-of-the-line 3D graphics!",https://shared.akamai.steamstatic.com/store_item_assets/steam/apps/3224770/header.jpg?t=1770102275,Gambling,"Cygames, Inc.","Jun 24, 2025",94% (Very Positive),"19,487","26,760",CrackProof®,N/A,None detected,online,Not reviewed yet,?,active,2026-03-17T06:37:19Z,2026-03-12 08:25:04+00:00
https://store.steampowered.com/app/1049590/,Eternal Return,"Eternal Return is a free-to-play, 2.5D perspective Battle Royale game. Search, Craft, Hunt, and Fight using a variety of characters. Plan your strategy and become the last survivor on this eternal experiment.",https://shared.akamai.steamstatic.com/store_item_assets/steam/apps/1049590/fa56f360467f675b777dd18a6315f00c84a7b9c4/header.jpg?t=1771469073,Battle Royale,Nimble Neuron,"Jul 19, 2023",76% (Mostly Positive),"7,491","7,491",-,N/A,None detected,online,Not reviewed yet,?,active,2026-03-17T06:37:20Z,2026-03-12 08:25:08+00:00
https://store.steampowered.com/app/1407200/,World of Tanks,"World of Tanks is a tactical action game with very different gameplay depending on the vehicle type and role. Aside from regular PvP, there are competitive and clan-based modes, special PvE and PvPvE events, and much more. Whether you play to dominate or just enjoy the ride, you'll fit right in.",https://shared.akamai.steamstatic.com/store_item_assets/steam/apps/1407200/819fc92f7ddb96ef10792a6d72382c5b814d671a/header.jpg?t=1772701747,MMO,Wargaming Group Limited,"Apr 28, 2021",81% (Very Positive),"3,446","4,651",-,80,None detected,online,Not reviewed yet,?,active,2026-03-17T06:37:21Z,2026-03-12 08:25:11+00:00
https://store.steampowered.com/app/444200/,World of Tanks Blitz,"Blow off steam and tank turrets in a free-to-play online 7v7 tank shooter! Drive hundreds of tanks, from museum classics to &quot;did-that-ever-exist?&quot; specials, in quick 5 to 7-minute brawls packed with metal mayhem. Play solo or team up with a friend and enjoy smooth action even on modest hardware!",https://shared.akamai.steamstatic.com/store_item_assets/steam/apps/444200/bd64dd64069d31a55e803ca181f4e1b6df7c9ae5/header.jpg?t=1772795095,MMO,Wargaming Group Limited,"Nov 9, 2016",78% (Mostly Positive),"2,319","3,482",-,N/A,None detected,online,Not reviewed yet,?,active,2026-03-17T06:37:23Z,2026-03-12 08:25:15+00:00
https://store.steampowered.com/app/1284210/,Guild Wars 2®,"Guild Wars 2 is an award-winning online roleplaying game with fast-paced action combat, deep character customization, and no subscription fee required. Choose from an arsenal of professions and weapons, explore a vast open world, compete in PVP modes and more. Join over 16 million players now!",https://shared.akamai.steamstatic.com/store_item_assets/steam/apps/1284210/header.jpg?t=1769556226,MMORPG,ArenaNet®,"Aug 23, 2022",89% (Very Positive),"3,905","3,905",-,90,None detected,online,Not reviewed yet,?,active,2026-03-17T06:37:24Z,2026-03-12 08:25:18+00:00
https://store.steampowered.com/app/1286830/,STAR WARS™: The Old Republic™,"STAR WARS™: The Old Republic™ is a free-to-play MMORPG that puts you at the center of your own story-driven saga. Play as a Jedi, Sith, Bounty Hunter, or one of many other iconic STAR WARS roles in the galaxy far, far away over three thousand years before the classic films.",https://shared.akamai.steamstatic.com/store_item_assets/steam/apps/1286830/header.jpg?t=1772549924,MMORPG,Broadsword,"Jul 21, 2020",90% (Very Positive),"3,972","3,972",-,85,None detected,online,Not reviewed yet,?,active,2026-03-17T06:37:26Z,2026-03-12 08:25:21+00:00
https://store.steampowered.com/app/766570/,Russian Fishing 4,"Russian Fishing 4 is a fishing simulator with RPG elements. There is no story line and the whole process is based on the concept of an open, free to roam and free to play game.",https://shared.akamai.steamstatic.com/store_item_assets/steam/apps/766570/header.jpg?t=1752656375,Fishing,FishSoft LLC,"Nov 10, 2021",58% (Mixed),"8,717","11,689",-,N/A,None detected,online,Not reviewed yet,?,active,2026-03-17T06:37:28Z,2026-03-12 08:25:24+00:00
https://store.steampowered.com/app/2584990/,Shadowverse: Worlds Beyond,"Shadowverse: Worlds Beyond is a brand-new strategy card game from the popular Shadowverse CCG. With the newly added super-evolution mechanic and Shadowverse Park, among other brand-new content, there is lots to enjoy for both seasoned and brand-new players.",https://shared.akamai.steamstatic.com/store_item_assets/steam/apps/2584990/bab5a90e2765d340ca3ba8553e1b0ee679176dda/header.jpg?t=1772083189,Card Game,"Cygames, Inc.","Jun 14, 2025",29% (Mostly Negative),"6,969","6,969",-,N/A,None detected,online,Not reviewed yet,?,active,2026-03-17T06:37:29Z,2026-03-12 08:25:28+00:00
https://store.steampowered.com/app/2074920/,The First Descendant,The First Descendant is a third-person looter shooter powered by Unreal Engine 5. Become a Descendant. Fight for the survival of humanity. Descendants have unique abilities to tackle both solo and co-op missions. Up to 4 players use varied mechanics to defeat giant bosses. BE THE FIRST DESCENDANT!,https://shared.akamai.steamstatic.com/store_item_assets/steam/apps/2074920/77535f4dbe96252bc3b39225fb0af454a4dd4942/header.jpg?t=1772678291,Looter Shooter,"NEXON Games Co., Ltd.","Jun 30, 2024",57% (Mixed),"5,290","5,290",-,N/A,Easy Anti-Cheat<br>None machine activation limit,online,Not reviewed yet,?,active,2026-03-17T06:37:30Z,2026-03-12 08:25:31+00:00
https://store.steampowered.com/app/4187020/,Murmurs of the Mist,"In this game, you’ll encounter puzzles which require you to use your environment in order to solve them. Take note of every detail, they can help you in uncovering Sofia’s story.",https://shared.akamai.steamstatic.com/store_item_assets/steam/apps/4187020/e81ce83c83f9941f58f017fe79f4772dc0cb1a47/header.jpg?t=1768148065,Horror,"Jenna Yourstone, Alfred Johansson, Alva Höglund, Bernard Ooi, Mohsen Parchami, Lucille Brändström, Robin Hammar, Kenji Sakurai, Valeria Hernández Ponce, Szymon Holowczak","Jan 11, 2026",88% (Very Positive),0,0,-,N/A,None detected,offline,Not reviewed yet,?,active,2026-03-17T06:37:32Z,2026-03-12 08:25:34+00:00
https://store.steampowered.com/app/1461130/,LAVALAMP,"3D first-person walking simulator with a side of exploration/interaction with the environment. The game tells the story of the Space Lemmings from Space who, after running many experiments with breakfast alphabet and the space-time continuum, got blocked between dimensions (or something).",https://shared.akamai.steamstatic.com/store_item_assets/steam/apps/1461130/header.jpg?t=1768101438,Walking Simulator,The Space Lemmings from Space Productions,"Jan 10, 2026",95% (Very Positive),0,0,-,N/A,None detected,offline,Not reviewed yet,?,active,2026-03-17T06:37:34Z,2026-03-12 08:25:37+00:00
https://store.steampowered.com/app/3650860/, Why? - Chapter 1,"Why? is a horror game where you are trapped inside a magical mansion where a series of dreadful events took place. Its hallways twist into shifting labyrinths, while a relentless monster hunts you down. It’s up to you to hide… and survive.",https://shared.akamai.steamstatic.com/store_item_assets/steam/apps/3650860/a7efd7986cb47cf3816d678ced8ec93492e09ce5/header.jpg?t=1768076204,Horror,Orchalys,"Jan 10, 2026",69% (Mixed),0,0,-,N/A,None detected,offline,Not reviewed yet,?,active,2026-03-17T06:37:36Z,2026-03-12 08:25:40+00:00
https://store.steampowered.com/app/1063590/,Rogue Masters,Rogue Masters is a 6 player co-op horde survival game with souls-like combat and extensive character customization where you fight Entropy in long-lost civilizations.,https://shared.akamai.steamstatic.com/store_item_assets/steam/apps/1063590/header.jpg?t=1768051617,Souls-like,"Advance Garde, Main Leaf","Jan 10, 2026",63% (Mixed),50,50,-,N/A,None detected,online,Not reviewed yet,?,active,2026-03-17T06:37:37Z,2026-03-12 08:25:43+00:00
https://store.steampowered.com/app/3731580/,Space Station: Beyond,Play as a variety of creatures or characters and try to survive either maintaining or attacking a space station while everything that can go wrong has already gone wrong.,https://shared.akamai.steamstatic.com/store_item_assets/steam/apps/3731580/17d9e76620b2b8c09cb92ab2855be9348df9be66/header.jpg?t=1768004241,MMO,DEATHB4DEFEAT,"Jan 9, 2026",86% (Very Positive),15,16,-,N/A,None detected,online,Not reviewed yet,?,active,2026-03-17T06:37:39Z,2026-03-12 08:25:50+00:00
https://store.steampowered.com/app/4178370/,Ascendancy,"Watch a hundred AI-controlled characters, each with randomized stats, drop into a chaotic, obstacle-filled arena in an intense simulation. Scavenge weapons, armor, and loot scattered across the map while observing thrilling battles unfold in real time. only one can remains.",https://shared.akamai.steamstatic.com/store_item_assets/steam/apps/4178370/8035a3db64f98623261274348544bed9d1386caa/header.jpg?t=1768013472,Battle Royale,xy7368,"Jan 9, 2026",75% (8 user reviews),0,0,-,N/A,None detected,offline,Not reviewed yet,?,active,2026-03-17T06:37:41Z,2026-03-12 08:25:54+00:00
https://store.steampowered.com/app/3825780/,WonderKing,"The return of classic 2D side-scrolling action! WonderKing is a free-to-play MMORPG packed with flashy combat and deep progression. Advance through diverse classes, master unique combos, and party up with friends for epic boss raids. Start your adventure today!",https://shared.akamai.steamstatic.com/store_item_assets/steam/apps/3825780/12f6f40d58a51f94ba687b875247bc1d5def2ae3/header_alt_assets_0.jpg?t=1773192242,MMO,dreamideasoft,"Jan 12, 2026",44% (Mixed),455,455,-,N/A,None detected,online,Not reviewed yet,?,active,2026-03-17T06:37:43Z,2026-03-12 08:25:57+00:00
https://store.steampowered.com/app/3760180/,Virtual City Playground®: Build Your Metropolis,"Relaxing city builder where you grow a vibrant metropolis, produce goods, manage transit and build iconic landmarks at your own pace.",https://shared.akamai.steamstatic.com/store_item_assets/steam/apps/3760180/466e4e2e3afcec867336f60a44b68c85fe2ed467/header.jpg?t=1771960984,City Builder,G5 Entertainment AB,"Jan 12, 2026",84% (Very Positive),12,15,-,N/A,None detected,online,Not reviewed yet,?,active,2026-03-17T06:37:44Z,2026-03-12 08:26:00+00:00
https://store.steampowered.com/app/2707930/,Palia,"Discover a welcoming world in Palia, a free-to-play fantasy life sim adventure where you can craft, explore, and create the life and home of your dreams. With nearly endless ways to make Palia your home, you’ll find relaxation and joy in every corner of this vibrant, heartwarming world.",https://shared.akamai.steamstatic.com/store_item_assets/steam/apps/2707930/b083c84354a491693c46203f64e25eaaf7b78356/header.jpg?t=1747075758,Life Sim,Singularity 6 Corporation,"Mar 25, 2024",86% (Very Positive),"5,133","5,133",-,N/A,None detected,online,Not reviewed yet,?,active,2026-03-17T06:37:46Z,2026-03-12 08:26:07+00:00
https://store.steampowered.com/app/1818450/,STALCRAFT: X,STALCRAFT: X is the largest open-world online game in the Chernobyl Exclusion Zone. Explore the world full of mutants and anomalies alone or with friends — unforgettable emotions guaranteed.,https://shared.akamai.steamstatic.com/store_item_assets/steam/apps/1818450/ee3c64407b9a361737dae5f28a38298c6705761a/header.jpg?t=1772816304,MMORPG,EXBO,"Dec 9, 2022",74% (Mostly Positive),"5,527","9,214",-,N/A,None detected,online,Not reviewed yet,?,active,2026-03-17T06:37:48Z,2026-03-12 08:26:10+00:00
https://store.steampowered.com/app/835570/,Conqueror's Blade,"Conqueror's Blade gives you a chance to be a true warlord. Commanding medieval troops in epic 15 vs. 15 siege battles, conquering cities with allies in the open world or fighting against players from all over the world – it's you who make the choice.",https://shared.akamai.steamstatic.com/store_item_assets/steam/apps/835570/04212e10f741243c8dd2fc98139862574df7ef95/header.jpg?t=1767008199,MMORPG,Booming Tech,"Apr 5, 2020",68% (Mixed),"2,239","2,239",-,N/A,None detected,online,Not reviewed yet,?,active,2026-03-17T06:37:50Z,2026-03-12 08:26:13+00:00
https://store.steampowered.com/app/2437170/,SMITE 2,"Become a god and wage war in SMITE 2, the free-to-play Unreal Engine 5-powered sequel to the legendary third-person action MOBA. If you love challenging competition, intense action, ability-driven combat, rewarding teamwork, or godly mythology, you’ll see why 40+ million players love SMITE.",https://shared.akamai.steamstatic.com/store_item_assets/steam/apps/2437170/e2b0ca43a4c7af0e0a2186fbf839f18fa36aeb80/header_alt_assets_14.jpg?t=1773093917,MOBA,Titan Forge Games,"Aug 27, 2024",56% (Mixed),"7,389","7,389",-,N/A,None detected,online,Not reviewed yet,?,active,2026-03-17T06:37:51Z,2026-03-12 08:26:16+00:00
https://store.steampowered.com/app/3199170/,Blood Strike,"Gather your friends and dive into the action-packed Battle Royale, Squad Fight, or Hot Zone like there's no tomorrow! Blood Strike offers a wide range of playable Strikers, each with a unique active and passive ability letting you deploy drones, shield walls and everything in between.",https://shared.akamai.steamstatic.com/store_item_assets/steam/apps/3199170/header.jpg?t=1748342194,Battle Royale,NetEase Games,"Mar 13, 2025",81% (Very Positive),"5,800","5,800",-,N/A,None detected,online,Not reviewed yet,?,active,2026-03-17T06:37:53Z,2026-03-12 08:26:19+00:00
https://store.steampowered.com/app/1282270/,Strinova,Strinova is an anime-style third-person tactical competitive shooter. Switch freely between three-dimensional and two-dimensional forms in this one-of-a-kind game that offers a unique tactical shooting system for an unparalleled experience.,https://shared.akamai.steamstatic.com/store_item_assets/steam/apps/1282270/b60d83f0ebbdf0cc790cb39d65c2cfaf799be190/header.jpg?t=1773295442,Hero Shooter,iDreamSky,"Nov 21, 2024",75% (Mostly Positive),"1,689","1,789",ACE,N/A,None detected,online,Not reviewed yet,?,active,2026-03-17T06:37:54Z,2026-03-12 08:26:22+00:00
https://store.steampowered.com/app/1721470/,Poppy Playtime,You must stay alive in this horror/puzzle adventure. Try to survive the vengeful toys waiting for you in the abandoned toy factory. Use your GrabPack to hack electrical circuits or nab anything from afar. Explore the mysterious facility... and don't get caught.,https://shared.akamai.steamstatic.com/store_item_assets/steam/apps/1721470/00ca34a0c863a8d86c6582904249216d6aa263bd/header.jpg?t=1770858202,Horror,Mob Entertainment,"12 Oct, 2021",87% (Very Positive),"3,336","3,336",-,N/A,None detected,offline,Free Chapter 1 Only,?,active,2026-03-17T06:37:56Z,2026-03-12 08:26:25+00:00
https://store.steampowered.com/app/2072560/,DRAGON BALL GEKISHIN SQUADRA,DRAGON BALL GEKISHIN SQUADRA is Dragon Ball's first team-oriented free to play game.,https://shared.akamai.steamstatic.com/store_item_assets/steam/apps/2072560/eb151a2237125fa69d7cd3b40d835c023c15d083/header.jpg?t=1768373806,MOBA,"GANBARION Co., Ltd.","Sep 9, 2025",65% (Mixed),"1,365","1,365",-,N/A,None detected,online,Not reviewed yet,?,active,2026-03-17T06:38:26Z,2026-03-12 08:26:29+00:00
https://store.steampowered.com/app/3354750/,skate.,"Experience improved Flick-It controls, the rich physics based skateboarding gameplay that provides those “only in skate.™“ moments and off-board exploration for full freedom in the online multiplayer world of San Vansterdam.",https://shared.akamai.steamstatic.com/store_item_assets/steam/apps/3354750/79c5a87b61a396cc6e6b69e3a083727f175dea83/header.jpg?t=1773170186,Sports,Full Circle,"Sep 16, 2025",69% (Mixed),"3,176","3,176",EA Javelin AntiCheat,N/A,None detected,online,Not reviewed yet,?,active,2026-03-17T06:38:27Z,2026-03-12 08:26:31+00:00
https://store.steampowered.com/app/2051620/,Enlisted,"In Enlisted, you are not only commanding a single soldier, but an entire squad! This MMO squad based shooter recreates the key battles of the bloodiest war of the 20th century, with hundreds of soldiers, tanks and aircraft taking part in each battle.",https://shared.akamai.steamstatic.com/store_item_assets/steam/apps/2051620/4a0b159885e6b1b9c55610cfffe428b74584fe63/header.jpg?t=1771499794,MMO,Darkflow Software,"Jul 16, 2024",80% (Very Positive),"2,182","2,182",BattlEye,N/A,None detected,online,Not reviewed yet,?,active,2026-03-17T06:38:29Z,2026-03-12 08:26:34+00:00
https://store.steampowered.com/app/1568590/,Goose Goose Duck,Goose Goose Duck is a game of social deduction for up to 16 players. Players are separated into different groups that are each assigned a different objective. Complete your team’s objective to win!,https://shared.akamai.steamstatic.com/store_item_assets/steam/apps/1568590/header.jpg?t=1772646502,Social Deduction,"Gaggle Studios, Inc.","Oct 3, 2021",87% (Very Positive),"3,297","3,297",Easy Anti-Cheat,N/A,None detected,online,Not reviewed yet,?,active,2026-03-17T06:38:31Z,2026-03-12 08:26:37+00:00
