link,name,desc,header_image,genre,developer,release_date,reviews,current_players,peak_today,anti_cheat,metacritic,drm_notes,type_game,notes,safe,status,last_updated,added_at
https://store.steampowered.com/app/3353080/,2024: Aliens Are Coming,"An Indie Sci-Fi Adventure game that thrusts you into the heart of the secrecy surrounding UFOs and Aliens. Visit exotic places, meet Aliens, make alliances and enemies alike as you make critical decisions and fight for what you think is right. Time is short, because it's 2024, and Aliens Are Coming!",https://shared.akamai.steamstatic.com/store_item_assets/steam/apps/3353080/header.jpg?t=1736195989,Platformer,Startroop L.L.C.,"Jan 6, 2025",52% (Mixed),0,0,-,N/A,None detected,offline,Not reviewed yet,?,active,2026-03-17T06:41:15Z,2026-03-12 08:31:32+00:00
https://store.steampowered.com/app/3380760/,2024: Mosaic Retrospective,2024: Mosaic Retrospective is a charity-fundraising picross/minesweeper hybrid featuring a single ENORMOUS puzzle inspired by global news stories from throughout the year.,https://shared.akamai.steamstatic.com/store_item_assets/steam/apps/3380760/header.jpg?t=1760618110,Puzzle,Mark Ffrench,"Dec 30, 2024",90% (Very Positive),37,37,-,N/A,None detected,offline,Not reviewed yet,?,active,2026-03-17T06:41:17Z,2026-03-12 08:31:35+00:00
https://store.steampowered.com/app/2540960/,2099 Gravity Havoc,Shoot at enemies in a WEIGHTLESS space station to save yourself from burning alive in the atmosphere!,https://shared.akamai.steamstatic.com/store_item_assets/steam/apps/2540960/header.jpg?t=1721174686,Top-down Shooter,XP Studio,"Sep 5, 2023",64% (Mixed),0,0,-,N/A,None detected,offline,Not reviewed yet,?,active,2026-03-17T06:41:19Z,2026-03-12 08:31:38+00:00
https://store.steampowered.com/app/1689730/,20b,"Eight peculiar students, a pair of highly-trained assassins, extraterrestrials plotting a full-scale invasion of Earth, a secret society on the verge of toppling the US presidency and a Doomsday cult gearing to wipe California off the map.",https://shared.akamai.steamstatic.com/store_item_assets/steam/apps/1689730/header.jpg?t=1665581143,Visual Novel,idk?,"Feb 9, 2022",83% (Very Positive),0,0,-,N/A,None detected,offline,Not reviewed yet,?,active,2026-03-17T06:41:20Z,2026-03-12 08:31:40+00:00
https://store.steampowered.com/app/2788440/,A 20-year-old RPG Maker game remade with the latest RPG MAKER UNITE and available for free?! ~The Heroes of the RPG Maker series vs. the Demon Lord~,"The game that was created 20 years ago with RPG MAKER 2000 has been remade in the latest RPG MAKER UNITE!(←the story setting, but it's true that RPG MAKER UNITE was made!) Let's enjoy this new RPG Maker experience, which fuses nostalgia and chaos!",https://shared.akamai.steamstatic.com/store_item_assets/steam/apps/2788440/aa1499926d65e0e7fa96996ee5f1a2e36f560cdf/header.jpg?t=1743738863,Top-down Shooter,Gotcha Gotcha Games,"Mar 5, 2025",81% (Positive),0,0,-,N/A,None detected,offline,Not reviewed yet,?,active,2026-03-17T06:41:22Z,2026-03-12 08:31:44+00:00
https://store.steampowered.com/app/1627520/,2236 A.D. Secretary Stories,"A prequel to 2236 A.D. which features a nonsensical story between man and AI that seems heartwarming but may actually be heartwarming. In other words, it's a visual novel about how Masuko is cute.",https://shared.akamai.steamstatic.com/store_item_assets/steam/apps/1627520/1ac42bf6d1c88606ca2201399fc35a78e20156de/header.jpg?t=1759445231,Visual Novel,Chloro,"Jul 23, 2021",80% (Very Positive),0,0,-,N/A,None detected,offline,Not reviewed yet,?,active,2026-03-17T06:41:24Z,2026-03-12 08:31:47+00:00
https://store.steampowered.com/app/1814980/,2310 seconds in HELL,"This is a very short game. Has an average level of difficulty. If you do not know what to do, then try to complete this game in less than 2310 seconds.",https://shared.akamai.steamstatic.com/store_item_assets/steam/apps/1814980/header.jpg?t=1694508156,Parkour,HeFake,"Mar 4, 2022",77% (Mostly Positive),1,1,-,N/A,None detected,offline,Not reviewed yet,?,active,2026-03-17T06:41:48Z,2026-03-12 08:31:49+00:00
https://store.steampowered.com/app/1715840/,25 Layers of Pain,Are you tired of being happy? Does life keep giving you everything you want? Are you finally ready to turn that frown right-side-up? Play 25 Layers of Pain. The game for masochists.,https://shared.akamai.steamstatic.com/store_item_assets/steam/apps/1715840/header.jpg?t=1731443352,Platformer,Beautiful Void Studio,"Oct 13, 2021",79% (Mostly Positive),0,0,-,N/A,None detected,offline,Not reviewed yet,?,active,2026-03-17T06:41:50Z,2026-03-12 08:31:53+00:00
https://store.steampowered.com/app/2704120/,256vs256,This Game is Simple! Light! Dynamic! You can experience playing a classic game of 'Go' or 'Chess' while playing a '3D Real-Time Battle Game'. You can also feel the emotions of the Battle Field.,https://shared.akamai.steamstatic.com/store_item_assets/steam/apps/2704120/header.jpg?t=1707709205,MOBA,Tetrahedron Studio,"Feb 11, 2024",84% (Positive),0,0,-,N/A,None detected,online,Not reviewed yet,?,active,2026-03-17T06:41:51Z,2026-03-12 08:31:56+00:00
https://store.steampowered.com/app/3395920/,25920,Three dimensional grid turn-based strategy game. Combat the computer or your friends to prove your brain is less smooth than theirs.,https://shared.akamai.steamstatic.com/store_item_assets/steam/apps/3395920/header.jpg?t=1735139092,Turn-based Strategy,BmoneyDC,"Dec 25, 2024",73% (Mostly Positive),0,0,-,N/A,None detected,offline,Not reviewed yet,?,active,2026-03-17T06:41:53Z,2026-03-12 08:31:59+00:00
https://store.steampowered.com/app/855010/,270 | Two Seventy US Election,Do you have what it takes to become President of the United States? Can you win the Two Seventy (270) Electoral Votes needed for victory in the US Election?,https://shared.akamai.steamstatic.com/store_item_assets/steam/apps/855010/header.jpg?t=1592416385,Strategy,Political Games LLC,"May 31, 2018",76% (Mostly Positive),5,5,-,N/A,None detected,offline,Not reviewed yet,?,active,2026-03-17T06:41:54Z,2026-03-12 08:32:02+00:00
https://store.steampowered.com/app/822550/,2DGameManias Taken,2DGameManias Taken is a 2.5D retro platform game in which you have been Taken by the unknown and you need to fight your way to freedom.,https://shared.akamai.steamstatic.com/store_item_assets/steam/apps/822550/header.jpg?t=1585756367,Platformer,2DGameMania,"May 4, 2018",40% (Mostly Negative),0,0,-,N/A,None detected,offline,Not reviewed yet,?,active,2026-03-17T06:41:56Z,2026-03-12 08:32:05+00:00
https://store.steampowered.com/app/1329110/,2ECONDS TO STΔRLIVHT: Forever My Diamond,"As graduation looms, true feelings begin to surface. Will Grace find the courage to overcome her shyness and bare her heart to Sera, or will her handsome rival Akira get to her first? A free VN about being really gay for your best friend. Part of the NOISZ series, and prequel to NOISZ STΔRLIVHT.",https://shared.akamai.steamstatic.com/store_item_assets/steam/apps/1329110/header.jpg?t=1633741971,Visual Novel,"SKY HOUR WORKS, Anarch Entertainment","Sep 2, 2020",84% (Very Positive),0,0,-,N/A,None detected,offline,Not reviewed yet,?,active,2026-03-17T06:41:57Z,2026-03-12 08:32:08+00:00
https://store.steampowered.com/app/1479030/,2ECONDS TO STΔRLIVHT: My Heart's Reflection,"&quot;The day I put that uniform on, I saw myself in the mirror for the first time. And I dared to think, maybe, just maybe...&quot; A free VN about standing up to the world to be yourself. Part of the NOISZ series, and prequel to NOISZ STΔRLIVHT.",https://shared.akamai.steamstatic.com/store_item_assets/steam/apps/1479030/header.jpg?t=1633894934,Visual Novel,"SKY HOUR WORKS, Anarch Entertainment","Jan 22, 2021",84% (Very Positive),0,0,-,N/A,None detected,offline,Not reviewed yet,?,active,2026-03-17T06:41:58Z,2026-03-12 08:32:11+00:00
https://store.steampowered.com/app/2133330/,2tinycowboys,"2tinycowboys is an action-packed western-themed arcade multi-scrolling platformer in 2D, with huge variety, in which you take the role of one of 9 different cowboys, each with his/her own play-style. It has up to 4 players split-screen multiplayer available and quirky game-play and characters.",https://shared.akamai.steamstatic.com/store_item_assets/steam/apps/2133330/0ae02e0e65d799a6f8bc69848586dbaa1e726516/header.jpg?t=1763672190,Platformer,André Esbjörnson,"Sep 13, 2022",45% (Mixed),0,0,-,N/A,None detected,offline,Not reviewed yet,?,active,2026-03-17T06:42:00Z,2026-03-12 08:32:15+00:00
https://store.steampowered.com/app/1182040/,3 Blind Mice: A Remediation Game for Improper Children,A remediation game designed for last attempt corrections for particularly troubled youth. Failure to complete this game may result in removal from society. Please do not attempt to find the surveillance units. They are only present for monitoring your progress. Have a pleasant day.,https://shared.akamai.steamstatic.com/store_item_assets/steam/apps/1182040/header.jpg?t=1573606778,Horror,James Earl Cox III,"Nov 7, 2019",78% (Mostly Positive),0,0,-,N/A,None detected,offline,Not reviewed yet,?,active,2026-03-17T06:42:02Z,2026-03-12 08:32:18+00:00
https://store.steampowered.com/app/2317560/,3 Days War,"3 Days War is a unique multiplayer strategy war game. Integrating the mechanics of RTS+4X, it allows dozens of players to engage in a three-day real-time strategy competitionon. Commanders, use your skills, strategies, games and even deception to become the ultimate winner!",https://shared.akamai.steamstatic.com/store_item_assets/steam/apps/2317560/header.jpg?t=1724642878,Strategy,荆棘鸟工作室,"Apr 16, 2023",84% (Very Positive),13,20,-,N/A,None detected,online,Not reviewed yet,?,active,2026-03-17T06:42:04Z,2026-03-12 08:32:22+00:00
https://store.steampowered.com/app/1683070/,3 O'clock Horror,This is a Lovecraftian-inspired tale of a man writing the horrors of the one night he visited his great uncle's mansion to remember what actually happened at 3 am during the visit.,https://shared.akamai.steamstatic.com/store_item_assets/steam/apps/1683070/header.jpg?t=1634088887,Horror,3 O'clock grymlins Team,"Jul 19, 2021",71% (Mostly Positive),0,0,-,N/A,None detected,offline,Not reviewed yet,?,active,2026-03-17T06:42:05Z,2026-03-12 08:32:25+00:00
https://store.steampowered.com/app/1908490/,30 Days to be the Best - Ultimate Edition,You have a dream... but the clock is ticking. Your determination and your own two fists are all you have left. Make them count. 30 Days to be the Best is a 3D fighting game with RPG and time management elements.,https://shared.akamai.steamstatic.com/store_item_assets/steam/apps/1908490/header.jpg?t=1699180693,Beat 'em up,Nuskadamo,"Sep 22, 2022",72% (Mostly Positive),0,0,-,N/A,None detected,offline,Not reviewed yet,?,active,2026-03-17T06:42:07Z,2026-03-12 08:32:28+00:00
https://store.steampowered.com/app/1344570/,300k - The Game,...a funny implementation of the cellular automaton theory.,https://shared.akamai.steamstatic.com/store_item_assets/steam/apps/1344570/header.jpg?t=1737486372,Turn-based Strategy,PixelNadja,"Jul 23, 2020",82% (Positive),0,0,-,N/A,None detected,offline,Not reviewed yet,?,active,2026-03-17T06:42:09Z,2026-03-12 08:32:31+00:00
https://store.steampowered.com/app/1202480/,36 apples,Collect apples and uncover the secrets of a self-contained world.,https://shared.akamai.steamstatic.com/store_item_assets/steam/apps/1202480/header.jpg?t=1666988387,Puzzle,aberrator,"Jan 31, 2020",92% (Very Positive),0,0,-,N/A,None detected,offline,Not reviewed yet,?,active,2026-03-17T06:42:11Z,2026-03-12 08:32:35+00:00
https://store.steampowered.com/app/2909280/,3AM CORP: The Balbazar Resort,"Beware of Balbazar in this horror/psychological thriller adventure. Evade the enigmatic Balbazar, use your wits and homemade sleuth kit to capture proof that something ominous is happening, and make it out alive. Do not get caught. The cops aren't doing anything... perhaps there's a reason.",https://shared.akamai.steamstatic.com/store_item_assets/steam/apps/2909280/header.jpg?t=1748059779,Horror,Alien Big Cat,"Jun 5, 2024",67% (Mixed),0,0,-,N/A,None detected,offline,Not reviewed yet,?,active,2026-03-17T06:42:12Z,2026-03-12 08:32:38+00:00
https://store.steampowered.com/app/3969130/,3am on Fish Island,Walk the streets of Fish Island and collect food. Become sober. Stay alert. There are ghosts. Made with the Godot Engine.,https://shared.akamai.steamstatic.com/store_item_assets/steam/apps/3969130/8a909d68c3de4e3685730717665217bc35924bef/header.jpg?t=1757792649,Horror,krishGames,"Sep 13, 2025",57% (Mixed),0,0,-,N/A,None detected,offline,Not reviewed yet,?,active,2026-03-17T06:42:14Z,2026-03-12 08:32:41+00:00
https://store.steampowered.com/app/943960/,3Buttons,"3Buttons is a short free-to-play platformer where you will only need three buttons to play! Choose between three different geometrical shapes; Sphere, Capsule, and the dreaded Cube. There are three different campaigns, in each you can submit your High Score for the global leaderboards! Good luck.",https://shared.akamai.steamstatic.com/store_item_assets/steam/apps/943960/header.jpg?t=1667118486,Platformer,John Segerstedt,"Oct 25, 2018",61% (Mixed),0,0,-,N/A,None detected,offline,Not reviewed yet,?,active,2026-03-17T06:42:15Z,2026-03-12 08:32:44+00:00
https://store.steampowered.com/app/1657880/,3Cushion Masters,This is a game that has signed an official license contract with a professional sports league hosted by the Professional Billiard Association (PBA).,https://shared.akamai.steamstatic.com/store_item_assets/steam/apps/1657880/header.jpg?t=1745637521,Sports,spogames,"Jul 18, 2021",51% (Mixed),14,14,-,N/A,None detected,offline,Not reviewed yet,?,active,2026-03-17T06:42:17Z,2026-03-12 08:32:47+00:00
https://store.steampowered.com/app/1600530/,3D Aim Trainer,"The #1 free aim trainer - now on Steam and SteelSeries GG. Join 13+ millions of FPS/TPS players improving flicks, tracking &amp; reaction speed with pro drills, analytics &amp; leaderboards. Dominate in Valorant, CS2, Apex &amp; more. Play free and start hitting every shot. #AimToConquer",https://shared.akamai.steamstatic.com/store_item_assets/steam/apps/1600530/header.jpg?t=1755858350,FPS,3D Aim Trainer,"Jul 7, 2021",87% (Very Positive),29,29,-,N/A,None detected,offline,Not reviewed yet,?,active,2026-03-17T06:42:19Z,2026-03-12 08:32:50+00:00
https://store.steampowered.com/app/367990/,3D Paraglider,"Do you dream of flying without restrictions, getting as close as possible to mother nature? If yes, then 3D Paraglider is for you.",https://shared.akamai.steamstatic.com/store_item_assets/steam/apps/367990/header.jpg?t=1695402339,Sports,khos85,"Aug 3, 2015",43% (Mixed),0,0,-,N/A,None detected,offline,Not reviewed yet,?,active,2026-03-17T06:42:21Z,2026-03-12 08:32:53+00:00
https://store.steampowered.com/app/1083700/,3D Text Adventure,This Australian Indie studio is committed to converting the old Infocom text adventures to 3d first person adventures. 3D Text Adventure is the first of these to be developed. These infocom remakes are practically exactly the same as the originals.,https://shared.akamai.steamstatic.com/store_item_assets/steam/apps/1083700/header.jpg?t=1572215893,Puzzle,Ariel Love,"Sep 10, 2019",49% (Mixed),0,0,-,N/A,None detected,offline,Not reviewed yet,?,active,2026-03-17T06:42:22Z,2026-03-12 08:32:56+00:00
https://store.steampowered.com/app/2659230/,3DC,3DC is a graphic adventure that teaches children from 8 to 12 years old what depression is.,https://shared.akamai.steamstatic.com/store_item_assets/steam/apps/2659230/header.jpg?t=1706734467,Simulation,Kim Martinez,"Jan 31, 2024",65% (Mixed),0,0,-,N/A,None detected,offline,Not reviewed yet,?,active,2026-03-17T06:42:24Z,2026-03-12 08:33:00+00:00
https://store.steampowered.com/app/1129690/,3x64,Connect blocks of the same colors on the constantly changing gravity! Try to survive as long as possible - you can call for help many mighty powerups or even craft your own!,https://shared.akamai.steamstatic.com/store_item_assets/steam/apps/1129690/header.jpg?t=1767279981,Puzzle,Lightning Soft,"Oct 31, 2019",93% (Positive),0,0,-,N/A,None detected,offline,Not reviewed yet,?,active,2026-03-17T06:42:26Z,2026-03-12 08:33:02+00:00
https://store.steampowered.com/app/1065670/,4004-022,"In the year 2040 you and the 12 billion inhabitants of the Earth fled from the Earth after being attacked by extraterrestrials, you took refuge on a planet named 4004-022, but this planet is also being attacked by aliens.",https://shared.akamai.steamstatic.com/store_item_assets/steam/apps/1065670/header.jpg?t=1611082934,Bullet Hell,Aaron D.,"May 5, 2019",42% (Mixed),0,0,-,N/A,None detected,offline,Not reviewed yet,?,active,2026-03-17T06:42:27Z,2026-03-12 08:33:06+00:00
https://store.steampowered.com/app/361630/,404Sight,404Sight is a free game made in support of net neutrality. It’s a 3D playground runner influenced by parkour running with the addition of a special ping ability that reveals areas that can speed the player up or slow them down.,https://shared.akamai.steamstatic.com/store_item_assets/steam/apps/361630/header.jpg?t=1575513224,Platformer,Retro Yeti Games,"Apr 16, 2015",85% (Very Positive),2,2,-,N/A,None detected,offline,Not reviewed yet,?,active,2026-03-17T06:42:29Z,2026-03-12 08:33:09+00:00
https://store.steampowered.com/app/1536830/,41 Hours: Prologue,"41 Hours is a first-person shooter dramatic game that follows the narrative of Ethan, a workaholic scientist in search of his long-lost wife. This is a one-hour prologue of the incredible, action-packed journey.",https://shared.akamai.steamstatic.com/store_item_assets/steam/apps/1536830/header.jpg?t=1649862749,FPS,Texelworks,"Mar 19, 2021",59% (Mixed),0,0,-,N/A,None detected,offline,Not reviewed yet,?,active,2026-03-17T06:42:30Z,2026-03-12 08:33:12+00:00
https://store.steampowered.com/app/787980/,4D Minesweeper,4D Minesweeper brings the classic mechanics of Minesweeper into the fourth dimension and adds some new features to it.,https://shared.akamai.steamstatic.com/store_item_assets/steam/apps/787980/header.jpg?t=1541187241,Puzzle,Julian Schlüntz,"Feb 14, 2018",94% (Very Positive),5,5,-,N/A,None detected,offline,Not reviewed yet,?,active,2026-03-17T06:42:32Z,2026-03-12 08:33:15+00:00
https://store.steampowered.com/app/2520610/,4D:XD,4D:XD is a top-down 2D bullet hell space shooter. Conquer the game with as few deaths as possible!,https://shared.akamai.steamstatic.com/store_item_assets/steam/apps/2520610/header.jpg?t=1693924339,Bullet Hell,Ryan Brammen,"Sep 5, 2023",82% (Positive),0,0,-,N/A,None detected,offline,Not reviewed yet,?,active,2026-03-17T06:42:33Z,2026-03-12 08:33:18+00:00
https://store.steampowered.com/app/3180460/,4fools1,"4Fools1 is game combined bullet-hell with interactive-fiction. Player will play as an imperial soldier, navigating through choices to uncover different endings in the story mode. Alternatively, one can engage in direct combat with diverse enemies in level mode, striving to become the last survivor.",https://shared.akamai.steamstatic.com/store_item_assets/steam/apps/3180460/header.jpg?t=1749979194,Bullet Hell,eeyzs1,"Jun 15, 2025",83% (Positive),0,0,-,N/A,None detected,offline,Not reviewed yet,?,active,2026-03-17T06:42:35Z,2026-03-12 08:33:21+00:00
https://store.steampowered.com/app/3609170/,4STORY : The Original,"Between Berkilious, the God of Destruction, and Lea, the Goddess of creation, long-lasting antagonism has repeated numerous creations and destructions. In the name of the Goddess Lea, exists the world of Iveria. In this world of chaos, will there be a hero to end this war once and for all?",https://shared.akamai.steamstatic.com/store_item_assets/steam/apps/3609170/aed22a59c057c7da1c9fadc16c9856f0cfafb065/header.jpg?t=1768978908,MMORPG,Zemi Interactive,"Jun 10, 2025",34% (Mostly Negative),6,9,-,N/A,None detected,online,Not reviewed yet,?,active,2026-03-17T06:42:37Z,2026-03-12 08:33:25+00:00
https://store.steampowered.com/app/1632020/,4Prot,4Prot is an interactive prototyping laboratory that allows you to create virtual spaces for students and professionals to creatively build different types of prototypes. The free version of 4Prot allows you to save 2 projects with 100 blocks each.,https://shared.akamai.steamstatic.com/store_item_assets/steam/apps/1632020/header.jpg?t=1739972593,City Builder,VR Labs,"Aug 9, 2021",63% (Mixed),1,1,-,N/A,None detected,offline,Not reviewed yet,?,active,2026-03-17T06:42:39Z,2026-03-12 08:33:27+00:00
https://store.steampowered.com/app/2220170/,2D Dawg 2,"Продолжение, которое никто не ждал и не просил! Встречайте - 2D Dawg 2! Ну если кто не понял, это типа сиквел той самой первой новеллы, где Макс с Тайхеем вместе... спит.",https://shared.akamai.steamstatic.com/store_item_assets/steam/apps/2220170/header.jpg?t=1680879744,Visual Novel,Тот Самый,"Apr 7, 2023",89% (Very Positive),0,0,-,N/A,None detected,offline,Not reviewed yet,?,active,2026-03-17T06:42:40Z,2026-03-12 08:33:31+00:00
https://store.steampowered.com/app/1570790/,2D Platformer GAME (Toy Factory),It is a 2D adventure game with cute characters.,https://shared.akamai.steamstatic.com/store_item_assets/steam/apps/1570790/header.jpg?t=1749052393,Platformer,Jo.Jo art,"Apr 1, 2021",94% (Very Positive),0,0,-,N/A,None detected,offline,Not reviewed yet,?,active,2026-03-17T06:42:42Z,2026-03-12 08:33:34+00:00
https://store.steampowered.com/app/922450/,4X-Galaxy 无主之地：银河,“4X-Galaxy” is a game developed by the 4X concept system(eXplore、eXpand、eXploit、eXterminate),https://shared.akamai.steamstatic.com/store_item_assets/steam/apps/922450/header.jpg?t=1584328393,Strategy,Mercator,"Dec 20, 2018",51% (Mixed),0,0,-,N/A,None detected,online,Not reviewed yet,?,active,2026-03-17T06:42:43Z,2026-03-12 08:33:37+00:00
https://store.steampowered.com/app/3074660/,5 Crowns,"When crowns tremble and oaths shatter, Bianké ignites. Gather your allies, wield steel and cunning, and lead the Amethyst Fangs in a tactical RPG where every decision forges the story… or dooms it.",https://shared.akamai.steamstatic.com/store_item_assets/steam/apps/3074660/75984e7589fa355081357ac2e4d8d2692df2a31e/header.jpg?t=1760818830,Turn-based Strategy,HoriZon,"Aug 13, 2024",91% (Positive),0,0,-,N/A,None detected,offline,Not reviewed yet,?,active,2026-03-17T06:42:45Z,2026-03-12 08:33:40+00:00
https://store.steampowered.com/app/2375740/,5 Minute Climb,5 minutes to jump to the top. Fall and it's back to the start.,https://shared.akamai.steamstatic.com/store_item_assets/steam/apps/2375740/header.jpg?t=1692074868,Platformer,RonEvansGameDev,"Aug 14, 2023",79% (Mostly Positive),0,0,-,N/A,None detected,offline,Not reviewed yet,?,active,2026-03-17T06:42:46Z,2026-03-12 08:33:44+00:00
https://store.steampowered.com/app/1830480/,50,COLLECT MEMBERS!ENFORCE YOUR MEMBER!MAKE YOUR OWN RAIDER!,https://shared.akamai.steamstatic.com/store_item_assets/steam/apps/1830480/header.jpg?t=1655563413,Strategy,XYZStudio,"Mar 11, 2022",44% (Mixed),0,0,-,N/A,None detected,offline,Not reviewed yet,?,active,2026-03-17T06:42:48Z,2026-03-12 08:33:47+00:00
https://store.steampowered.com/app/2835750/,50 Floors: The Paranormal Investigators Prologue,Find a way out.,https://shared.akamai.steamstatic.com/store_item_assets/steam/apps/2835750/header.jpg?t=1719174092,Horror,Arsonist Studio,"May 31, 2024",76% (Mostly Positive),0,0,-,N/A,None detected,offline,Not reviewed yet,?,active,2026-03-17T06:42:50Z,2026-03-12 08:33:50+00:00
https://store.steampowered.com/app/2136090/,500 Second Challenge,"As the ladder gets faster and narrower, can you increase your living space through the upgrade system? Last for 500 seconds, and your gameplay will be different from everyone else's depending on how your skills level up.",https://shared.akamai.steamstatic.com/store_item_assets/steam/apps/2136090/header.jpg?t=1664443087,Platformer,HSNU_BBCAT,"Sep 29, 2022",68% (Mixed),0,0,-,N/A,None detected,offline,Not reviewed yet,?,active,2026-03-17T06:42:51Z,2026-03-12 08:33:54+00:00
https://store.steampowered.com/app/2542430/,5050,"Each time you press the button, it will either double or lose all the points you’ve put in. How much will you risk?",https://shared.akamai.steamstatic.com/store_item_assets/steam/apps/2542430/header.jpg?t=1764936885,Gambling,Follow the fun,"Aug 20, 2023",89% (Very Positive),1,1,-,N/A,None detected,offline,Not reviewed yet,?,active,2026-03-17T06:42:53Z,2026-03-12 08:33:57+00:00
https://store.steampowered.com/app/2443820/,52 / 0 = ∞,"This is a story with illustrations. You have to choose your destiny. You are obsessed with the idea of creating an ideal society. One day you come up with a genius idea, and you create a society that could live forever, BUT HOW IS THIS POSSIBLE!!?",https://shared.akamai.steamstatic.com/store_item_assets/steam/apps/2443820/2a5353aeb617540bf5a17a3eb6ad67856f09e6b3/header.jpg?t=1751549687,Visual Novel,HeFake,"Jul 3, 2025",89% (Very Positive),1,1,-,N/A,None detected,offline,Not reviewed yet,?,active,2026-03-17T06:42:55Z,2026-03-12 08:34:00+00:00
https://store.steampowered.com/app/1059420/,5Leaps (Space Tower Defense),5Leaps is a retro-futuristic strategy game &quot;Tower Defense&quot; style.,https://shared.akamai.steamstatic.com/store_item_assets/steam/apps/1059420/header.jpg?t=1671323625,Tower Defense,DeepDimensionGames,"May 15, 2019",100% (Positive),0,0,-,N/A,None detected,offline,Not reviewed yet,?,active,2026-03-17T06:42:56Z,2026-03-12 08:34:03+00:00
https://store.steampowered.com/app/1557760/,6 Feet Behind,Your pursuer is your only weapon.,https://shared.akamai.steamstatic.com/store_item_assets/steam/apps/1557760/header.jpg?t=1739028927,Beat 'em up,ApeHardware,"Mar 16, 2021",93% (Positive),0,0,-,N/A,None detected,offline,Not reviewed yet,?,active,2026-03-17T06:42:58Z,2026-03-12 08:34:05+00:00
